{
  "iso": "dan",
  "edition": "den-frie-bibel",
  "partition": "decisions",
  "licence": "CC0-1.0 (Den Frie Bibel: public domain)",
  "orthography": {
    "normalization": "NFC",
    "ignore_marks": []
  },
  "entries": [
    {
      "id": "term:H3068",
      "kind": "term",
      "source": "H3068",
      "value": "HERREN",
      "alternatives": [
        {
          "value": "Herren",
          "note": "used for אֲדֹנָי, not for YHWH"
        }
      ],
      "evidence": [
        {
          "ref": "JON 1:1",
          "form": "HERRENS",
          "n": 3443
        },
        {
          "ref": "JON 1:3"
        },
        {
          "ref": "JDG 4:14"
        }
      ],
      "confidence": "high",
      "method": "project-decision",
      "by": "project:dan/dan_BSB",
      "date": "2026-10-13",
      "status": "decided",
      "note": "Small capitals in print; HERREN in the text files. Genitive HERRENS.",
      "attested": "attested"
    },
    {
      "id": "formula:word_of_yhwh_came",
      "kind": "formula",
      "source": "וַיְהִי דְּבַר־יְהוָה אֶל־<X>",
      "value": "HERRENS ord kom til <X>",
      "pattern": "HERRENS ord kom til <X>",
      "evidence": [
        {
          "ref": "JON 1:1"
        }
      ],
      "confidence": "high",
      "method": "corpus-observed",
      "by": "person:example",
      "date": "2026-10-14",
      "status": "observed",
      "attested": "attested"
    },
    {
      "id": "name:nebuchadnezzar",
      "kind": "name",
      "source": "נְבוּכַדְנֶאצַּר",
      "value": "Nebukadnesar",
      "attested": "attested",
      "evidence": [
        {
          "ref": "JER 27:6",
          "form": "Nebukadnesars"
        },
        {
          "ref": "JER 27:20"
        }
      ],
      "confidence": "high",
      "method": "corpus-observed",
      "by": "agent:dan001",
      "date": "2026-10-13",
      "status": "observed",
      "note": "The MT spells the name two ways (Dan 1:1, 1:18); one Danish form."
    },
    {
      "id": "name:shinar",
      "kind": "name",
      "source": "שִׁנְעָר",
      "value": "Sinear",
      "attested": "attested",
      "evidence": [
        {
          "ref": "GEN 10:10"
        },
        {
          "ref": "GEN 11:2"
        }
      ],
      "confidence": "high",
      "method": "corpus-observed",
      "by": "agent:dan001",
      "date": "2026-10-13",
      "status": "observed"
    }
  ]
}
